{
  "$schema": "https://json-schema.org/draft/2020-12/schema",
  "$id": "https://purposesource.org/spec/schemas/registry-index.v1.json",
  "title": "Registry index shard — /registry/index/{shard}.json (and the bulk export)",
  "description": "One shard of the published registry index, sharded by the first character of the repository name plus a `0` shard for everything non-alphabetic (FS02-062). THE SAME DOCUMENT SHAPE serves the bulk export `/registry/export.json` (apex alias `/registry.json`, FS10-060): that document sets `shard: \"export\"` and carries every entry. Entries are the minimum a browse page or a scanner needs; the full per-repository facts live in the repo record, whose URL each entry carries. Every registered repository appears (ops decision D82 item 1): an entry's `state` is `registered` for a repository registered under the network's rules, whether or not its admins have claimed it, and `suspended`, `quit` or `delisted` as before. No entry says whether a repository's admins have claimed it (D82 item 3). *(Amended 2026-09-30, D82 and its dated note (d) of 2026-09-29, which close OPEN-33: it said \"Only `verified`, `suspended`, `quit` and `delisted` repositories appear — `detected` repositories are counted, never listed (GH-014, OPEN-33 default).\")*",
  "x-psn": {
    "specVersion": "1.4.0",
    "phase": "P-M2",
    "artifactPath": "/registry/index/{shard}.json · /registry/export.json",
    "authoritative": true,
    "producer": "index-build (P-M2: index-build-lite CI, VS-04)",
    "consumers": ["web registry browse (WEB-070/071/073)", "edge passthrough (FS10-060)", "SCA scanners / OSPO tooling"],
    "fsRefs": ["FS-00 §6.2", "FS-02 §7 (FS02-062)", "FS-10 §8 (FS10-060)"],
    "vsRefs": ["VS-04", "VS-17"],
    "changelog": "CHANGELOG.md#registry-indexv1json"
  },
  "type": "object",
  "additionalProperties": false,
  "required": ["schemaVersion", "generatedAt", "shard", "count", "entries"],
  "properties": {
    "schemaVersion": { "const": 1 },
    "generatedAt": { "type": "string", "format": "date-time" },
    "source": { "enum": ["registry-v0", "sample", "fixture", "platform"], "description": "Which plane produced this artifact. `sample` and `fixture` declare a NON-PRODUCTION plane: every page that renders such an artifact is labelled sample, and a production deployment refuses to serve it (FS-10 §2 v0 note; the edge route answers `sandbox_artifact_on_prod`). `registry-v0` is the P-M2 production source of record — the curated registry repository the index is built from. `platform` is the P-M3 producer of record — the platform database, rendered by `jobs.index-build`. Optional, and its absence asserts nothing: an artifact whose body cannot carry the label borrows the plane's declaration from `/registry/index/meta.json`. The enum widens additively when the P-M3 producer takes a value of its own, and `platform` (2026-09-12) is that widening: `jobs.index-build` writes it in `PSN_ENV=prod` and writes `fixture` in every other environment, so a reader can still tell a production plane from a synthetic one by the label alone." },
    "shard": {
      "type": "string",
      "pattern": "^([a-z0-9]|export)$",
      "description": "Shard key: a single lowercased first character of the repository name, `0` for non-alphabetic names, or the literal `export` for the bulk document."
    },
    "count": { "type": "integer", "minimum": 0, "description": "Number of entries in THIS document. Registry-wide totals live in the index meta document." },
    "entries": {
      "type": "array",
      "items": { "$ref": "#/$defs/entry" }
    }
  },
  "$defs": {
    "entry": {
      "type": "object",
      "additionalProperties": false,
      "required": ["nodeId", "owner", "name", "state", "weightClass", "recordUrl"],
      "properties": {
        "nodeId": { "$ref": "#/$defs/githubNodeId" },
        "owner": { "$ref": "#/$defs/githubLogin", "description": "Display cache only." },
        "ownerOrgId": { "$ref": "#/$defs/githubOwnerNodeId", "description": "The owner node_id the curated record carries as `owner_node_id` (`O_…` or `U_…`) — the same value `repo-record.v1` publishes as `owner.orgId`, and the key a Portfolio Entitlement's `scope.org` names (ops decision D42). On the entry so a Portfolio picker or a scanner can list an owner's repositories from the index alone. Absent when the registry records none. `owner` stays a display-cache login." },
        "name": { "type": "string", "minLength": 1, "maxLength": 100 },
        "state": { "enum": ["registered", "verified", "suspended", "quit", "delisted"], "description": "`registered`: the repository is registered under the network's rules, whether or not its admins have claimed it. It is the one state an artifact published from ops decision D82 on shows for both of the platform's internal states `detected` and `verified` (D82 item 1 and its dated note (d) of 2026-09-29). `verified` is the state artifacts published before D82 carried for a claimed repository; it stays valid for them (versioning policy 4), and a producer writes `registered` in its place from D82 on. `suspended`, `quit` and `delisted` are unchanged. The internal state `detected` never appears." },
        "weightClass": { "enum": ["standard", "major"] },
        "licenseId": { "type": "string", "pattern": "^[A-Za-z][A-Za-z0-9.+-]{1,63}$" },
        "licenseVersion": { "type": "string", "pattern": "^[0-9]+\\.[0-9]+$" },
        "adoptedAt": { "type": "string", "format": "date", "description": "Adoption date. `recentlyRegistered` ordering on the browse landing view uses this — cold-start fairness (WEB-073)." },
        "apacheConversionDate": { "type": "string", "format": "date" },
        "language": { "type": ["string", "null"], "maxLength": 40, "description": "Primary language, for the browse facet (WEB-071 v0 subset). Null when GitHub reports none." },
        "topics": { "type": "array", "maxItems": 12, "items": { "type": "string", "pattern": "^[a-z0-9][a-z0-9-]{0,31}$" } },
        "summary": { "type": "string", "maxLength": 300, "description": "Optional display summary echoed from PURPOSE.yml. Repository content — escaped on render." },
        "recordUrl": { "type": "string", "format": "uri", "description": "URL of this repository's repo record artifact." },
        "badgeUrl": { "type": "string", "format": "uri" },
        "pageUrl": { "type": "string", "format": "uri" }
      }
    },
    "githubLogin": { "type": "string", "pattern": "^[A-Za-z0-9](?:[A-Za-z0-9]|-(?=[A-Za-z0-9])){0,38}$" },
    "githubNodeId": { "type": "string", "pattern": "^([A-Za-z0-9_-]{4,128}|MDEwOlJlcG9zaXRvcnk[A-Za-z0-9+/=]{1,96})$", "description": "A GitHub GraphQL node_id, in either of the two forms GitHub has issued: the opaque current form (a repository's is `R_`-prefixed) and the legacy base64 form, whose decoded value begins `010:Repository` and whose `=` padding the first alternative cannot express. Widened 2026-09-08 to admit the second: `registry-v0-record.v1` accepts both, so a record the curated registry accepts is publishable in this artifact. The primary key for repositories and people throughout this contract set (FS-00 §6.1)." },
    "githubOwnerNodeId": { "type": "string", "pattern": "^[OU]_[A-Za-z0-9_-]{6,118}$", "description": "A GitHub GraphQL node_id of a repository OWNER in the current global-id form (`O_…` organisation, `U_…` user), as `registry-v0-record.v1` `$defs.githubOwnerNodeId` defines it. Local to this file because schemas here carry no cross-file `$ref`. Narrower than `githubNodeId` on purpose: that pattern would also admit a login such as `helvetica-tools`." }
  }
}
